{
  "schema_version": "kajiya.task_brief.v1",
  "kind": "kajiya_task_brief",
  "issue_id": "KBL-029",
  "created_at": "2026-05-30",
  "updated_at": "2026-05-30",
  "source_of_truth": "docs/task-briefs/KBL-029.json",
  "human_instruction": "Implement a read-only adopt-project command. It must inspect the current working directory using Path.cwd(), detect existing Kajiya-compatible artifacts, classify the repository, report whether init-project should not be used, report missing recommended artifacts, and return a JSON-compatible adoption plan. It must not create, modify, or delete files.",
  "evidence_refs": [
    "docs/input/kbl-029-adopt-project.json"
  ],
  "allowed_files": [
    "src/kajiya_build_line/adopt_project.py",
    "src/kajiya_build_line/cli.py",
    "docs/task-briefs/KBL-029.json"
  ],
  "validation_commands": [
    "python -m compileall src",
    "kajiya-build-line adopt-project",
    "kajiya-build-line qa",
    "kajiya-build-line validate-json",
    "git --no-pager diff --check"
  ],
  "forbidden_actions": [
    "Do not create, modify, or delete project files from adopt-project.",
    "Do not run init-project from adopt-project.",
    "Do not modify docs/state/backlog.json or docs/state/current-project.json.",
    "Do not commit.",
    "Do not push.",
    "Do not close issues automatically."
  ],
  "builder_mode": "bounded_patch_plan",
  "requires_human_approval": true,
  "next_safe_actions": [
    {
      "action": "run_builder_plan",
      "command": "/kajiya-builder-plan issue_id=KBL-029",
      "brief": "docs/task-briefs/KBL-029.json"
    },
    {
      "action": "review_brief",
      "path": "docs/task-briefs/KBL-029.json"
    }
  ]
}
