{
  "schema_version": "kajiya.task_brief.v1",
  "kind": "kajiya_task_brief",
  "issue_id": "KBL-027",
  "created_at": "2026-05-30",
  "updated_at": "2026-05-30",
  "source_of_truth": "docs/task-briefs/KBL-027.json",
  "human_instruction": "Implement durable deterministic test scenario artifacts. Add a JSON Schema for kajiya.test_scenario.v1. Add the first test scenario artifact for the KBL-025 add-issue --from-json temp repo behavior test. Update validate-json to validate docs/test-scenarios/*.json. Do not implement a scenario runner yet. This issue only creates the contract, the first scenario artifact, and the validation gate.",
  "evidence_refs": [
    "docs/evidence/kbl-025-add-issue-from-json.md"
  ],
  "allowed_files": [
    "docs/schemas/kajiya-test-scenario.schema.json",
    "docs/test-scenarios/KBL-025-add-issue-from-json.json",
    "src/kajiya_build_line/validate_json.py",
    "docs/task-briefs/KBL-027.json"
  ],
  "validation_commands": [
    "python -m compileall src",
    "kajiya-build-line validate-json",
    "kajiya-build-line qa",
    "git --no-pager diff --check"
  ],
  "forbidden_actions": [
    "Do not implement a test scenario runner.",
    "Do not modify docs/state/backlog.json or docs/state/current-project.json.",
    "Do not commit.",
    "Do not push.",
    "Do not close issues automatically."
  ],
  "builder_mode": "bounded_patch_plan",
  "requires_human_approval": true,
  "next_safe_actions": [
    {
      "action": "run_builder_plan",
      "command": "/kajiya-builder-plan issue_id=KBL-027",
      "brief": "docs/task-briefs/KBL-027.json"
    },
    {
      "action": "review_brief",
      "path": "docs/task-briefs/KBL-027.json"
    }
  ]
}
