{
  "schema_version": "kajiya.task_brief.v1",
  "kind": "kajiya_task_brief",
  "issue_id": "KBL-024",
  "created_at": "2026-05-30",
  "updated_at": "2026-05-30",
  "source_of_truth": "docs/task-briefs/KBL-024.json",
  "human_instruction": "Implement a read-only deterministic checkpoint command. It must inspect backlog/current-project state, git status --short, git diff --name-only, git diff --stat, latest commit, QA status, and validate-json status. It must return JSON-compatible output including active_issue_id, active_workstream, dirty, changed_files, diff_stat, latest_commit, qa_ok, validation_ok, task_brief_path, recommended_operator_action, and next_human_input_contract. Do not commit, do not push, do not close issues, and do not modify docs/state from checkpoint.",
  "evidence_refs": [
    "docs/evidence/kbl-023-add-issue-command.md"
  ],
  "allowed_files": [
    "src/kajiya_build_line/checkpoint.py",
    "src/kajiya_build_line/cli.py",
    "docs/task-briefs/KBL-024.json"
  ],
  "validation_commands": [
    "python -m compileall src",
    "kajiya-build-line checkpoint",
    "kajiya-build-line qa",
    "kajiya-build-line validate-json",
    "git --no-pager diff --check"
  ],
  "forbidden_actions": [
    "Do not commit.",
    "Do not push.",
    "Do not close backlog issues automatically.",
    "Do not modify docs/state/backlog.json or docs/state/current-project.json from checkpoint."
  ],
  "builder_mode": "bounded_patch_plan",
  "requires_human_approval": true,
  "next_safe_actions": [
    {
      "action": "run_builder_plan",
      "command": "/kajiya-builder-plan issue_id=KBL-024",
      "brief": "docs/task-briefs/KBL-024.json"
    },
    {
      "action": "review_brief",
      "path": "docs/task-briefs/KBL-024.json"
    }
  ]
}
